pubDate,title,description
2025-12-11 10:06:00,용산 정비창 '샅바싸움'…국토부 &quot;주택 많이&quot; vs 서울시 &quot;도움 안 돼&quot;,"과거 문재인 정부는 2020년 8·4 공급 대책을 통해 이 지역에 공공임대주택 등 1만호를 지으려 했지만, 서울시 협의를 거쳐 6000호로 줄인 상태다. 하지만 10·15 주택시장 안정화 대책 이후에도 부동산 시장 불안이 계속되자... "
2025-12-11 10:02:00,"서울 아파트, 대책 나올때마다 거래량 '출렁'…평균 매매가 13.1억",올해 부동산 대책이 발표될 때마다 서울과 경기도 아파트 매매 거래량이 출렁인 것으로 나타났다.... 서울시의 토지거래허가구역 해제와 확대 재지정이 있었던 2월과 3월 거래량은 전년 동기 대비 각각 149.9... 
2025-12-11 10:02:00,[특징주] 상지건설·KD 등 건설 중소형 관련주 강세...&quot;주택 빠르게 공급...,여기에 더해 서울시의 신속통합기획(신통기획) 2.0 적용 맞춤형 재개발 추진 소식도 영향을 준 것으로... 시는 특히 정부의 10·15 부동산 규제로 정비사업 추진 동력이 약해질 수 있다는 시민의 우려를 해소하기 위해... 
2025-12-11 10:02:00,"서울시, 중랑구·강남구·망원동 모아타운 토지거래허가구역 신규 지정",최진석 서울시 주택실장은 &quot;최근 급격한 주택 시장의 변동성 속 개발 기대감에 따른 투기 수요가 발생할 위험이 여전하다&quot;며 &quot;실수요자를 보호하고 투기를 근절하기 위해 부동산 시장 모니터링과 예방적 조치를... 
2025-12-11 10:02:00,"서울시, 모아타운 3곳 '토허제' 신규 지정…기존 63곳 1년 연장",최진석 서울시 주택실장은 &quot;최근 급격한 주택 시장 변동성 속에서 개발 기대감에 따른 과도한 투기 수요가 발생할 위험이 여전히 남아있다&quot;며 &quot;실수요자를 보호하고 투기 근절을 위해 부동산 시장 모니터링과 예방적... 
2025-12-11 10:01:00,"구룡마을, 3739세대 대단지 재탄생…미리내집 포함 임대주택 75% 공급 [부...","서울시 제18차 도시계획위원회 개최 구룡마을, 개발밀도 상향…총 219세대 증가 미리내집 1691세대 포함, 분양 951세대 불광동 범서구역, 최고 150m 업무시설 구룡마을 재개발 후 조감도. [서울시 제공] [헤럴드경제... "
2025-12-11 10:01:00,"서울시, 모아타운 3곳 토허구역 신규 지정·기존 63곳 연장 [부동산360]",최진석 서울시 주택실장은 “최근 급격한 주택 시장 변동성 속에서 개발 기대감에 따른 과도한 투기 수요가 발생할 위험이 여전히 남아있다”며 “실수요자를 보호하고 투기 근절을 위해 부동산 시장 모니터링과... 
2025-12-11 10:01:00,청담동 역세권 활성화 탄력…35층 복합개발로 업무·문화 중심축 재편 ...,"서울시, 10일 도시·건축공동위 개최 청담동 52번지, 업무·문화 복합개발 건대입구역 로데오거리, 청년특화거리 변신 청담동 52번지 일대 조감도 [자료=서울시] [헤럴드경제=서정은 기자] 서울시가 강남구 청담동 52번지... "
2025-12-11 10:00:00,"서울시, 불광동 역세권에 29층 업무시설 건립…&quot;서북권역 중심으로 재편...",서울시는 제18차 도시계획위원회를 개최하고 은평구 불광동 308-20번지 일대 '범서구역 도시정비형... 범서구역 도시정비형 재개발구역은 2020 서울시 도시·주거환경정비기본계획에 따라 정비예정구역으로 지정됐다.... 
2025-12-11 10:00:00,중랑·강남·마포 등 모아타운 대상지 3곳 ‘토허구역’ 신규 지정,최진석 서울시 주택실장은 “최근 급격한 주택 시장 변동성 속에서 개발 기대감에 따른 과도한 투기 수요가 발생할 위험이 여전히 남아있다”며 “실수요자를 보호하고 투기 근절을 위해 부동산 시장 모니터링과... 
2025-12-11 10:00:00,구룡마을 주택 공급 3739가구로 확대…45%는 미리내집[부동산AtoZ],서울시가 강남 무허가 판자촌 구룡마을에 공급하는 주택 물량을 3739가구로 늘리기로 했다. 이 중 45%는 신혼부부를 위한 장기전세주택 2로 공급된다. 서울시는 제18차 도시계획위원회에서 개포지구(구룡마을)... 
2025-12-11 10:00:00,"서울시, 토지거래허가구역 모아타운 3곳 신규·63곳 재지정",최진석 서울시 주택실장은 &quot;최근 급격한 주택 시장 변동성 속에서 개발 기대감에 따른 과도한 투기 수요가 발생할 위험이 여전히 남아있다&quot;며 &quot;실수요자를 보호하고 투기 근절을 위해 부동산 시장 모니터링과... 
2025-12-11 10:00:00,"서울시, 모아타운 3곳 도로 토허제 지정…기존 63곳 재지정",최진석 서울시 주택실장은 &quot;최근 급격한 주택 시장 변동성 속에서 개발 기대감에 따른 과도한 투기 수요가 발생할 위험이 여전히 남아있다&quot;며 &quot;실수요자를 보호하고 투기 근절을 위해 부동산 시장 모니터링과 예방적... 
2025-12-11 10:00:00,"서울시, 모아타운 사업 대상지 등 66곳 토지거래허가구역 지정",최진석 서울시 주택실장은 &quot;최근 급격한 주택 시장 변동성 속에서 개발 기대감에 따른 과도한 투기 수요가 발생할 위험이 여전히 남아있다&quot;며 &quot;실수요자를 보호하고 투기 근절을 위해 부동산 시장 모니터링과 예방적... 
2025-12-11 10:00:00,"마포구 공덕1구역, 인접 필지 편입·기반시설 변경으로 사업 탄력[부동...",서울시는 제18차 도시계획위원회를 개최해 마포구 공덕동 105-84번지 일대 공덕1구역 주택재건축정비사업 정비구역 및 정비계획 변경(안)을 수정가결했다고 11일 밝혔다. 2011년 구역 지정된 공덕1구역은 2020년... 
2025-12-11 10:00:00,"서울시, 신규 모아타운 대상지 3곳 토지거래허가구역 지정",최진석 서울시 주택실장은 &quot;최근 급격한 주택 시장 변동성 속에서 개발 기대감에 따른 과도한 투기 수요가 발생할 위험이 여전히 남아있다&quot;며 &quot;실수요자를 보호하고 투기 근절을 위해 부동산 시장 모니터링과 예방적... 
2025-12-11 09:59:00,'불붙은 학군지'···대치동 신고가에 수도권까지 꿈틀,부동산R114 자료를 보면 강북의 대표 학군지로 꼽히는 서울시 노원구 중계동의 10월 아파트 평균매매가는 7억5220만원으로 노원구에서 가장 높다. 서울 1군 학군지 못지 않은 대규모 학원가가 위치한 경기도 안양시... 
2025-12-11 09:56:00,서울 오피스빌딩 매매 주춤...거래량 전월比 52.9% ↓,"AI 기반 상업용 부동산 종합 서비스 기업 부동산플래닛(각자대표 정수민, 엄현포)이 11일 발표한 '10월 서울시 오피스 매매 및 임대시장 동향 보고서'에 따르면 서울시 오피스빌딩 매매거래량은 8건... "
2025-12-11 09:46:00,엇갈린 서울 오피스…빌딩 매매는 줄고 사무실 거래량은↑,11일 부동산플래닛의 서울시 오피스 매매 및 임대시장 동향 보고서에 따르면 9월 반등했던 오피스빌딩 매매시장은 10월 거래량과 거래금액이 모두 감소했다. 반면 사무실 시장은 종로구 신문로2가... 
2025-12-11 09:44:00,"대림1구역, 신통개발 2.0 적용…2035년까지 1026가구 공급",서울시는 영등포구 대림동 855-1번지 일대 대림1구역에 신통기획 2.0을 적용해 주거 환경개선과 재난 예방... 특히 10·15 부동산 대책으로 정비사업 추진 동력이 약화될 수 있다는 우려에 대응하고자 서울-국토부... 
2025-12-11 09:38:00,[N2 기고] 국민 스트레스 없애는 '주택가격 해법' 마련해야,서울시 아파트 전체가 거래되려면 13.3년이 필요하며 92.5% 사람들은 주택거래와는 아무런 상관없는 것으로 해석할 수 있다. 부동산(=주택)은 다른 상품과 달리 뚜렷한 속성을 가지고 있는데 대표적인 것이 개별성이다.... 
2025-12-11 09:24:00,"금천구, AI 행정 혁신 결실... 행안부 정책연구 발표대회 국무총리상 수...","- 데이터·AI 융합한 부동산 행정 혁신, 전국 공무원 연구대회서 주목 - AI 기술을 활용한 경계정보 서비스, 주민편익·행정효율 동시 강화 - ‘내 집 경계정보 확인 시스템’, 서울시·행안부 연속 수상으로 우수성 입증... "
2025-12-11 09:22:00,수도권 아파트 거래량 '출렁'…정책 발표 때마다 최대 180% 급등,"올해 정부와 서울시의 주요 부동산 정책이 잇달아 시행되면서 수도권 아파트 월별 거래량이 큰 폭의 등락을 반복한 것으로 나타났다. 토지거래허가제 조정, 대출 규제, 공급 확대 방안 등이 교차하며 지역별... "
2025-12-11 09:08:00,서울 오피스 시장 ‘엇갈린 10월’…매매는 숨 고르고 사무실은 거래 급...,부동산플래닛이 11일 발표한 서울시 오피스 매매 및 임대시장 동향 보고서에 따르면 9월 반등했던 오피스빌딩 매매시장은 10월 거래량과 거래금액이 모두 감소했다. 반면 사무실 시장은 종로구 신문로2가... 
2025-12-11 09:06:00,"정부·서울시, 재개발·재건축 구역지정권 자치구 이양 공방",정부가 부동산 공급대책을 발표해도 서울시가 협조하지 않으면서 정책 실효성이 낮아지자 신속한 정비사업 추진을 위해 정비구역 지정 권한을 자치구에 이전해야 한다고 주장하고 있다. 반면 서울시는 시 전체 발전의... 
2025-12-11 09:00:00,&quot;재개발·재건축 구역지정권 자치구로 이양&quot;…서울시 힘 뺀다,"정부가 발표한 부동산 공급대책이 서울시의 소극적·비협조적 태도로 무력화되자, 주택공급 확대 및 정비사업 활성화라는 명분으로 서울시를 우회해 자치구에 직접 권한을 넘기는'서울시 배제 전략'을 구사하는 것으로... "
2025-12-11 09:00:00,"44주 연속 상승세탄 서울 아파트값, '남성역 헤머튼'으로 가치 선점 나서...","한국부동산원이 발표한 12월 1주 서울 아파트 매매가격은 전주 대비 0.17% 오르며 44주 연속 상승을 기록했다.... 바로 가까이에서 남성역 역세권활성화 사업이 진행 중이며, 인근 사당12·15·16구역이 서울시 신속통합기획에... "
2025-12-11 09:00:00,"광진 벨라듀, 군자역 더블 역세권 알짜 단지로 주목","정부가 10.15 부동산 대책을 내놓은 지 한 달이 지난 가운데, 서울 아파트 매매가격 상승세는 3주 연속... 지난 4월 서울시의 지구단위계획 결정 고시를 득한 후 교통영향평가를 승인받는 등 사업 추진에 박차를 가하고... "
2025-12-11 09:00:00,"'청담 르엘', 하이엔드 단지의 주거 품격 기준 제시","서울시장상이 수여되는 '서울주거문화대상'에서 청담 르엘이 선정된 배경에는 대형 문주와 옥상... 부동산 전문가는 &quot;청담 르엘은 단순히 고가 아파트가 아니라, 브랜드 가치와 입주민 경험을 모두 고려한 하이엔드 단지... "
2025-12-11 08:58:00,&quot;둘도 아니고 하난데 잘 키워야죠&quot;…학부모들 몰리더니,최근 부동산 시장에서 학군지의 중요성이 더욱 커지고 있다. 교육 환경 양극화에 1군 학군지의 위상이... 강북의 대표 학군지인 서울시 노원구에서 아파트 평균 매매가가 가장 높은 곳은 학원가가 자리한 중계동... 
2025-12-11 08:56:00,규제에 출렁이는 서울 아파트 거래,"토지거래허가구역 지정, 주택담보대출 한도 축소 등 새 정부 들어 다양한 부동산 대책이 나오면서다.... 서울시 토지거래허가제 해제와 확대가 연이어 발표된 2월과 3월에는 서울 아파트 매매 거래량이 전년 동기... "
2025-12-11 08:51:00,"서울 아파트, 대책 나올때마다 거래량 '출렁'…평균 매매가 13.1억",올해 부동산 대책이 발표될 때마다 서울과 경기도 아파트 매매 거래량이 출렁인 것으로 나타났다.... 서울시의 토지거래허가구역 해제와 확대 재지정이 있었던 2월과 3월 거래량은 전년 동기 대비 각각 149.9... 
2025-12-11 08:28:00,"금천구, AI 행정 혁신으로 국무총리상 수상",금천구는 이 사업으로 서울시 주관 데이터 분석·활용 우수사례 경진대회에서도 우수상을 수상한 바 있다.... 스마트한 부동산 행정을 지속적으로 발전시켜 현장에서 체감할 수 있는 성과를 꾸준히 만들어 가겠다”고... 
2025-12-11 08:21:00,"금천구, 'AI 내 집 경계정보 시스템' 국무총리상 수상",구는 같은 사업으로 서울시 데이터 분석·활용 우수사례 경진대회에서도 우수상을 받았다. 유성훈... 한 스마트한 부동산 행정을 지속적으로 발전시켜 현장에서 체감할 수 있는 성과를 꾸준히 만들어 가겠다&quot;고 말했다.
2025-12-11 08:18:00,"[더벨][지엘산업개발은 지금]오너 2세 황준연, 고급주거 '원에디션' 키운...",부동산 디벨로퍼 지엘산업개발이 사업영역을 확장하는 과정에서 2세 경영진의 역할이 커지고 있다. 창업주... 처음으로 서울시 인허가를 받을 때 기부채납으로 공공임대주택을 공급하기로 해 수익성을 개선할 수 있었다.... 
2025-12-11 08:14:00,"금천구, AI 행정 혁신 결실... 행안부 정책연구 발표대회 국무총리상 수...",있다 /제공=금천구청©열린뉴스통신ONA 서울시 금천구(구청장 유성훈)는 행정안전부가 주관한 '제21회... 한 스마트한 부동산 행정을 지속적으로 발전시켜 현장에서 체감할 수 있는 성과를 꾸준히 만들어 가겠다&quot;고 말했다.
2025-12-11 07:46:00,용산정비창에 주택 2만 가구 넣겠다는 정부…서울시는 반발,서울시는 지역 민원과 장애물 등을 고려하며 협의하고 있다는 입장이다. 부동산 업계는 정부가 지자체와 충분히 협의하지 않고 일방적인 공급 발표에 나설 경우 문재인 정부 시절처럼 '속 빈 강정'이 될 것으로 보고... 
2025-12-11 07:44:00,[인터뷰]&quot;유튜브 이렇게 찍으면 세무조사 대상됩니다&quot;,"크리에이터와 건설·부동산 분야를 전문으로 하는 세무대리인으로, 2018~2022년 마포세무서 국선대리인을 지냈으며 현재 서울시 마을세무사로 활동 중이다. 또한 한국세무사회 조세제도연구위원, 세무연수원 교수... "
2025-12-11 07:34:00,"금천구, AI 행정 혁신 결실... 행안부 정책연구 발표대회 국무총리상 수...","데이터·AI 융합한 부동산 행정 혁신, 전국 공무원 연구대회서 주목 AI 기술을 활용한 경계정보 서비스, 주민편익·행정효율 동시 강화 ‘내 집 경계정보 확인 시스템’, 서울시·행안부 연속 수상으로 우수성 입증 수상... "
2025-12-11 07:26:00,"대림1구역, 신통기획 침수 오명 벗고 주택 공급·재난 예방 '일석이조'",한편 오세훈 시장은 12월 10일(수) 대림1구역을 찾아 현장을 점검하고 주민들을 직접 만나 서울시의 정비사업 추진 방안을 공유하고 주민들의 우려와 건의 사항을 청취했다. 오 시장은 &quot;정부의 10.15 부동산 규제대책으로... 
2025-12-11 06:36:00,절반 공실 '가로수길'…압구정 재건축하면 살아난다고?,가로수길 상권 회복의 열쇠는 압구정 재건축이라는 게 부동산 업계의 시각이다. 서울시는 압구정특별계획구역을 통해 압구정동 일대의 노후한 공동주택의 대대적인 재건축을 추진 중이다. 총 6개 구역으로 나뉜 압구정... 
2025-12-11 06:02:00,"반년 만에 10억 뛴 '강남 재건축 대장' 미도, 조합장 놓고 3파전","현장 설명회에 참석한 한 부동산 전문가는 “미도 아파트 전용 84㎡는 착공 시 60억, 준공 시 80억까지 갈 것이라는 전망이 나올 정도로 사업성이 좋다”고 말했다. ◇건설사 임원 VS 서울시의원 VS 건설 원가 전문가... "
2025-12-11 06:02:00,“눈 오면 집 밖을 못 나와요”…폭설 취약지 찾은 서울시 ‘바로봉사단...,이날 서울시자원봉사센터 ‘재난 대응 바로봉사단’은 미아동 주민자치위원회와 함께 ‘겨울愛 나눔-冬네... 그는 “이번 주말에 눈이 올 수 있다는 소식을 듣고 부동산 등 가게에도 제설제를 미리 뿌려달라고 안내할... 
2025-12-11 06:00:00,[오늘(11일)의 경제·산업 주요 일정·행사] '강한 소상공인 상생ON페어...,"(09시, 서울시 영등포구 선유로 146, 지하1층 강당) △ NE능률, 주주총회 개최 (09시, 서울특별시 마포구... 한국부동산원, 주간 아파트 가격 동향 △ 대한상의 이공계 인력부족 실태와 개선방안 보고서 △ 경총... "
2025-12-11 05:20:00,용산 정비창 놓고 서울시·정부 엇박자…&quot;충분한 협의가 첫 단추&quot;,"이번 갈등은 수도권 주택 공급 확대와 부동산 시장 안정 문제를 동시에 담고 있어 주목된다. 국토교통부와 서울시는 현재 협의 중이며, 유휴 부지 활용 등을 포함한 구체적인 공급 방안을 논의하고 있다. 11일 업계에... "
2025-12-11 05:05:00,"연말 수도권 공급방안, 9·7 대책 구체화 초점…내년 초 발표 가능성","11일 정치권과 부동산 업계에 따르면 정부는 도심 수요에 맞춘 주택 공급 정밀 로드맵을 준비하고 있으며... 현재 서울시와 국토부는 용산업무지구 주택 수 조정 문제를 놓고 협의를 진행 중이지만, 최종 결론은 나오지... "
2025-12-11 05:04:00,"상습 호우 피해 영등포 대림1구역, 침수 예방 35층짜리 단지로 재탄생","서울시는 대림1구역에 신속통합기획(신통기획) 2.0을 적용, 2035년까지 총 1026세대를 공급할 계획이라고 10일... 오 시장은 주민들의 우려 사항을 듣고 “정부의 10·15 부동산 대책으로 조합원 지위 양도 제한, 이주비... "
2025-12-11 05:00:00,머니투데이 오프라인 헤드라인-11일,"공직자 부동산 평균 20억…일반 국민의 5배 통일교·민주당 금품수수 의혹…특검, 경찰에 늑장 이첩 '시끌' [정책사회·문화] &quot;내국인도 도시민박 쓸 수 있게…&quot; 서울시, 관광규제 개선 건의 정원오 성동구청장 &quot;구청 간... "
2025-12-11 05:00:00,징수도 폐지도 못 한 재초환… 불확실성만 키우며 '공급 위축·양극화 우...,이연희 더불어민주당 의원실이 서울시로부터 제출받은 ‘서울 재건축 부담금 부과 예상 단지와 조합원... 본지 자문위원인 함영진 우리은행 부동산리서치랩장은 “최근 개포·반포·잠원·방배·여의도·당산 등 강남과... 
2025-12-11 04:31:00,"정원오 &quot;이 대통령과 같은 점은 '일잘러'… 오세훈, 계엄 반대 감사&quot;",다만 내년 6월 지방선거 서울시장 출마 여부에 대해서는 말을 아꼈다. 정 구청장은 10일 성동구에서 열린... 개발 사업에 대한 기대로 가격이 급등한 성수동 부동산에 대한 문제 의식도 드러냈다. 정 구청장은 &quot;최근 (평당)... 
2025-12-11 01:16:00,[뉴스공감] 세운4구역 개발이익 논란을 파헤친다,그리고 지금 서울 시내 지대와 오피스텔 분양가가 매년 한 3%에서 4% 정도 오릅니다. 그러면 이거는 주변 시세에 따르면 한 5천만 원까지도 받을 수 있다고 얘기를 해요. 주변 부동산들은. 세운4구역에서 제일 입지가 좋은... 
2025-12-11 00:33:00,"리모델링 추진하던 서울 아파트들, 재건축으로 선회 움직임",양지영 신한투자증권 수석은 “서울시 차원의 인센티브가 늘었지만 ‘10·15 부동산 대책’으로 재건축 규제도 강화됐기 때문에 사업 지연 가능성 및 그에 따른 금융 비용까지 따져봐야 한다”고 말했다.
2025-12-10 22:34:00,모두싸인이 공개한 한국형 계약 AI “CLM 시장 표준되겠다”,"공공 부문에서는 공무원연금공단, 한국자산관리공사, 서울시 등 200개 이상의 기관이 도입했다. 지난해... 이뿐 아니라 모두싸인은 부동산 시장을 핵심 거점 시장으로 선정하고 생애주기 전략으로 접근한다. 이영준... "
2025-12-10 21:34:00,"오세훈 서울시장, 한국공인중개사협회 만나 부동산 거래 안정화 방안 모...","오 시장은 현장의 반응을 전달받고 “부동산 현장의 최일선에 계신 만큼 부동산 거래 안정화를 위해 힘써달라”라며, “서울시 또한 협회와의 긴밀한 협력으로 힘을 보태겠다”라고 말했다."
2025-12-10 19:31:00,"오세훈 &quot;집값 대책 없다는 대통령 발언, 하면 안 되는 말&quot;",그러면서 &quot;10·15 대책은 당연히 일어날 수 있는 부동산 거래조차 틀어막는 효과는 있을지 몰라도 공급에 확신을 주는 대책이 아니었다&quot;며 주택 공급 대책의 중요성을 강조했다. 최근 논란이 된 서울시의 광화문 '감사의 정원... 
2025-12-10 19:00:00,"오세훈 &quot;대통령 발언, 집값 더 올릴 수 있다...하면 안될 말씀&quot;",오세훈 서울시장이 이재명 대통령의 &quot;수도권 집값에 대책이 없다&quot;는 발언을 정면 비판하며 &quot;시장에 잘못된... 말씀은 부동산 가격을 오히려 앙등시킬 수 있어 하면 안 되는 말씀&quot;이라며 이같이 밝혔다. 앞서 이 대통령은... 
2025-12-10 18:58:00,오세훈 “‘감사의 정원’ 정부개입 과도해…행정 탈 쓴 탄압”,서울시가 광화문 광장에 조성하는 ‘감사의 정원’을 두고 김윤덕 국토교통부 장관이 법적 하자가 있는지... 그러면서 “10·15 대책은 당연히 일어날 수 있는 부동산 거래조차 틀어막는 효과는 있을지 몰라도 공급에 확신을... 
2025-12-10 18:22:00,오세훈 &quot;'감사의 정원' 이 잡듯 뒤지겠다니…행정의 탈 쓴 탄압&quot;(종합),발언&quot; 서울시가 광화문 광장에 조성하는 '감사의 정원'을 두고 김윤덕 국토교통부 장관이 법적 하자가 있는지... 그러면서 &quot;10·15 대책은 당연히 일어날 수 있는 부동산 거래조차 틀어막는 효과는 있을지 몰라도 공급에... 
2025-12-10 18:17:00,오세훈 &quot;대통령 발언 부동산시장 자극 우려&quot;…'총리 하명행정' 직격도,&quot;과거엔 없던 과도한 정치 행위&quot; 정부여당 비판 오세훈 서울시장이 최근 정부가 세운4구역 재개발과 한강버스... ‘10·15 부동산 규제대책’ 후 이재명 대통령의 발언을 두고는 &quot;사실상 서울 집값 잡을 뾰족한 방법이 없다는... 
2025-12-10 18:16:00,오세훈 “집값 대책 없다는 대통령 발언…하시면 안 되는 말씀”,있는 부동산 거래조차 틀어막는 효과는 있을지 몰라도 공급에 확신을 주는 대책이 아니었다”고 비판했다. 아울러 김윤덕 국토교통부 장관이 같은 날 국회 국토교통위원회 전체회의에서 서울시가 추진 중인 감사의 정원에... 
2025-12-10 18:14:00,정원오 “내 별명은 ‘순한 맛 이재명’…대통령과 닮은 점은 ‘일잘러...,서울시 주택 공급 활성화 방안에 대해선 “부동산 분위기가 좋을 땐 재개발·재건축 조합 주민들의 사업 추진 속도가 빨라지는 데 비해 서울시 도시계획심의위원회와 건축위원회 단계에서 진도가 늦어지는 ‘병목 현상’... 
2025-12-10 18:13:00,"&quot;그 땅, 결국 돈 된다&quot; 기대감 폭발…요즘 증권가서 뜨는 회사",기업이 보유한 부동산 가치가 상승하면서 자산 재평가가 이뤄질 것이라는 논리다. 시장 전문가들은 부동산... 서울시가 신세계센트럴과 서울고속버스터미널이 제출한 대규모 개발안을 바탕으로 사전 협상에 들어가자... 
2025-12-10 18:01:00,"정원오 &quot;서울 부동산 급등, 오세훈 책임…李정부, 어쩔 수 없이 나섰다...",'오세훈 칭찬해달라' 요청에는 &quot;오세훈 '계엄 반대' 감사&quot; 화답… &quot;나는 '순한맛 이재명'&quot; 더불어민주당 서울시장 후보군인 정원오 성동구청장이 내년 서울시장 지방선거의 핵심 요인으로 꼽히는 부동산 정책과 관련... 
2025-12-10 17:58:00,"오세훈 시장, 한국공인중개사협회 만나 부동산 거래 안정화 방안 모색","오 시장은 현장의 반응을 전달받고 &quot;부동산 현장의 최일선에 계신 만큼 부동산 거래 안정화를 위해 힘써달라&quot;라며, &quot;서울시 또한 협회와의 긴밀한 협력으로 힘을 보태겠다&quot;고 말했다."
