pubDate,title,description
2025-12-04 06:01:00,"여의도 재건축 급물살 타자… 줄줄이 신고가, 대교 13억 올라","대교아파트는 서울 신통기획 자문사업 1호 사업지로 10년 넘게 걸리던 인허가 과정이 크게 단축, 조합 설립... 다만 10·15 부동산 대책 발표 후 가격 상승세에 제동이 걸렸다는 평가도 나온다. 여의도를 포함해 서울 전역이... "
2025-12-04 06:00:00,[오늘(4일)의 경제·산업 주요 일정·행사] 'AI콘텐츠 페스티벌 2025' 등,"(09시, 서울시 영등포구 국회대로70길 23 용산빌딩 11층 서울평가정보㈜ 제2회의실) △ 에스엠벡셀... 한국부동산원, 주간 아파트 가격 동향 △ 국립호남권생물자원관, '2025 섬 생물다양성 심포지엄' 개최 (13시... "
2025-12-04 05:20:00,도봉 '둘리 동네'서 제2판교로? 차량기지 이전·서울 아레나 기대감,"서울시는 이 일대를 디지털 바이오 R&amp;D 거점으로 키워 메가 바이오 벨트로 구축한다는 방침이다. 인근... KB부동산에 따르면 11월 말 기준 도봉구 아파트 평균 매매가는 5억 9500만 원이지만, '동아 청솔' 전용 84㎡는 10월... "
2025-12-04 05:00:00,"국민의힘 서울시 청년의원들 “대장동 개발, 진상 규명 필요”","서울시 청년의원들은 3일 이재명 정권의 부동산 정책 실패, 경제 위기 관리 부실, 대장동 사태 책임 회피 등을 강력히 규탄했다. 또 국민의힘에 ‘내란’ 프레임을 씌우고 있다며 이에 강력히 반발했다. 국민의힘 소속... "
2025-12-04 05:00:00,"10·15 대책은 '시간 벌기용'…정부, 2단계 주택 공급 카드 준비","정부의 10·15 부동산 대책 이후 수도권 비규제지역을 중심으로 풍선효과가 뚜렷해지면서 과거 '핀셋 규제... 국토부와 서울시도 도심 주택공급 실무협의체를 출범시켜, 유휴 국·공유지와 노후 공공청사, 정비사업 인허가... "
2025-12-04 04:31:00,임대 의무 낮추면 목동 조합원 ‘1.6억 더’…규제 완화 시동 [AI 프리즘...,서울 신당8구역은 아크로 브랜드 요구가 거절되자 DL이앤씨와 시공사 계약을 해지했고 입주 시점이... [부동산 투자자 관심 뉴스] 1. 임대비율 50%→30% 땐 목동 1~3단지 환급금 1.5억 늘어 목동 1~3단지 정비사업의... 
2025-12-04 04:30:00,빌라 살아도 매달 100만원 꼬박꼬박...월세살이 만만치 않네,서울지역 비아파트 임대시장의 월세가 연일 상승하는 가운데 서울시가 추진 중인 소규모 오피스텔 규제완화가 임대시장 공급확대로 이어질지 주목된다. 3일 한국부동산원에 따르면 지난 10월 서울 연립·다세대... 
2025-12-04 04:23:00,'미리내집'도 돈 있는 신혼부부 몫?…신규 70% 정책대출 못 받는다,것이 서울시 관계자 설명이다. 아울러 알려진 고급 주거단지를 제외하더라도 서울의 높은 전세가로 인해 많은 미리내집 가구의 전세가가 대출기준을 넘어서는 상황이다. 지난 11월 기준 KB부동산 월간통계에 따르면... 
2025-12-04 04:14:00,내년 선거前에… 덜 오른 곳부터… 토허제 '부분해제' 가장 유력,"토허제 해제 '키'를 쥐고 있는 김윤덕 국토교통부 장관과 오세훈 서울시장의 비공개 만찬이 확인되면서 해제... 한국부동산원에 따르면 노원·도봉구 10월 아파트 매매가격지수는 각각 101.72, 100.76으로 지난해말 대비 1.49... "
2025-12-04 04:06:00,다시 만난 김윤덕-오세훈… 토허제 해제시점 조율,김윤덕 국토교통부 장관과 오세훈 서울시장이 비공개 회동을 한 것으로 확인됐다. 두 사람의 만남은 2주... 김 장관과 오 시장이 실무채널 가동 대신 직접 만난 것은 서울 부동산 시장의 상황이 그만큼 심각한 수준에... 
2025-12-04 00:37:00,세운4구역 일타강사 나선 오세훈…경관 논란 등 반박,"4일 서울시와 부동산 업계에 따르면, 서울시는 30여 분 분량의 '일타시장 오세훈 - 종묘와 세운4구역 이슈 총정리' 영상을 지난 3일 오후 서울시장 홈페이지(mayor.seoul.go.kr)에 공개했습니다. 대형 칠판 앞에 선 오 시장은... "
2025-12-04 00:24:00,"[주정완 논설위원이 간다] 주민 반발 부닥친 서리풀 2지구, 서울 주택공...",이때 브리핑에 함께 참석했던 오세훈 서울시장은 서리풀 지구에서 신혼부부 전용 장기전세주택(미리내집)... 서리풀 지구는 지난 9월 이재명 정부의 두 번째 부동산 대책인 ‘9·7 대책’(주택공급 확대방안)에도... 
2025-12-03 21:21:00,[미리보는 이데일리 신문]환율·관세 이어 법인세마저 高高高,"전환 △부동산 -강남·분당 vs 비규제 지역… 청약통장 어디 넣을까 -“정부 주도 물량 확보는 한계… 주택... 것” -서울시, 연말 심야택시·버스 늘린다 -외로운 당신… 인천시가 사다리 될게요 -‘취업명문’... "
2025-12-03 21:16:00,&quot;단지 지나가면 20만원&quot;…강동구 아파트 '외부인 부담금' 무슨일,"3일 부동산 업계와 인근 단지에 따르면 고덕아르테온 입주자대표회의는 최근 고덕그라시움 등 주변 단지에... 중앙 보행로는 아르테온 단지와 지하철 상일동역을 연결하는 주요 통행로로, 재건축 당시 서울시에 ‘공공... "
2025-12-03 20:26:00,강남 3구 아파트 20년간 285% 급등… 고가 행진속 대형 새단지 공급 잇따...,"이에 강남 부동산은 사놓기만 하면 오른다는 이른바 강남 불패 신화가 이어지고 있으며, 이 같은 흐름은... GS건설은 12월 서울시 강남구 역삼동 일원 역삼동(758·은하수·760) 주택재건축정비사업을 통해... "
2025-12-03 18:24:00,"오세훈, 세운4구역 개발 '일타강사'로 나서…&quot;결단 내릴 시점&quot;[부동산At...",종묘 앞 세운4구역 재개발 논란과 관련해 오세훈 서울시장이 개발 추진 과정 및 계획 등을 설명했다. 오 시장은 3일 서울시장 홈페이지에 공개된 '일타시장 오세훈 - 종묘와 세운4구역 이슈 총정리' 영상을 통해... 
2025-12-03 18:20:00,이상욱 서울시의원 &quot;12월 한파보다 더 가혹한 '주거 빈곤'&quot;,이상욱 서울시의원은 '이재명의 정권의 부동산 정책 실패 및 전세대란'에 대해 &quot;12월의 찬 바람보다 더 매섭고 가혹한 한파가 우리 서울의 청년들에게 몰아치고 있다. 바로 '주거 빈곤'이라는 한파&quot;라며 &quot;오늘 저는 서울... 
2025-12-03 18:08:00,"새마을금고중앙회장 김인ㆍ유재춘ㆍ장재곤 '3파전'…현안 산적, 쇄신 이...",2005년 새마을금고 서울시 실무책임자협의회장에 이름을 올린 뒤 1년 뒤인 2006년 새마을금고 전국... 새마을금고의 연체율은 부동산 프로젝트파이낸싱(PF) 부실 여파로 지난 수년간 기업대출을 중심으로 치솟았다. 올해... 
2025-12-03 17:56:00,다시 만난 김윤덕·오세훈…‘노도강·금관구’ 토허구역 해제 기대감 ...,말 서울시의회 정례회 시정질문에서도 “풍선효과가 우려되더라도 토허제 지정 지역을 최소화했어야 했는데 지나치게 넓게 지정됐다”며 “해제 여부를 검토할 시점이 됐다”고 언급한 바 있다. 최근 부동산 커뮤니티... 
2025-12-03 17:46:00,"서울시회, 소외계층에 '따뜻한 겨울나기' 성금 2000만원 전달",대한전문건설협회 서울시회(회장 김홍수)는 전문건설인의 따뜻한 마음을 담아 사회취약계층에 성금 및 쌀을... 구청 관계자들은 &quot;최근 부동산 등 경기 침체 및 경기 성장률 둔화 등으로 건설경기가 힘든 시간 속에서... 
2025-12-03 17:44:00,임대비율 50%→30% 땐 목동 1~3단지 환급금 1.5억 늘어 [집슐랭],"정부와 서울시가 임대주택 의무공급 비율을 법적 최저 수준인 30%까지 낮출 경우, 주요 사업장에서... 정부의 ‘10·15 부동산대책’에 따라 서울 전역이 투기과열지구에 지정됨에 따라 분양가상한제 적용 확대 가능성... "
2025-12-03 17:36:00,"전문건협 서울시회, 소외계층 후원활동 이어가",구청 관계자들은 “최근 부동산 등 경기 침체 및 경기 성장율 둔화 등으로 건설경기가 힘든 시간 속에서 어려운 이웃을 먼저 생각하고 성금을 기탁해주셔서 감사를 드린다”고 밝혔다. 김홍수 서울시회장은 “지역의... 
2025-12-03 17:35:00,"한국부동산마케팅협회, 취약계층에 ‘사랑의 연탄’ 5천 장 나눔","사단법인 한국부동산마케팅협회는 지난 2일 서울 중랑구 서일대 후문 배나무마을에서 취약계층의 따뜻한... 봉사에는 협회 산악회 강창록 회장(태풍씨앤디 대표이사)을 비롯해 회원사 대표 및 임직원, 서울시 매력... "
2025-12-03 17:32:00,"초역세권 입지 갖춘 '남성역 헤머튼', 동작구 사당동에 934세대 아파트 ...",12·15·16구역이 서울시 신속통합기획에 선정되는 등 정비사업이 활발하다. 이에 따라 사당동 일대의 주거 환경 개선과 지역 가치 상승에 대한 기대감이 커지고 있다. 부동산 업계 관계자는 &quot;초역세권·대단지·정비사업... 
2025-12-03 17:30:00,고광민 시의원 &quot;허위거래가 집값 흔들어… 실수요자 피해&quot;,"서울시의회 고광민 의원이 부동산 허위계약과 취소거래로 실거래가가 왜곡되고 있다며 대책을 촉구했습니다. 고 의원은 행정사무감사에서 &quot;가격 띄우기 거래가 반복되면 신혼부부와 청년, 무주택 서민이 가장 큰 피해를... "
2025-12-03 17:18:00,김윤덕·오세훈 비공개 회동...국토부 &quot;토허제 논의 안해&quot;,"국토부와 서울시는 주택 공급 확대를 위해 실무진 간 소통 채널을 가동하기로 하고 지난 21일 양 기관 실무진은 '부동산대책 제1차 실무협의회'를 개최한 바 있다. 당시 국토부는 서울시에 유휴부지, 노후 공공청사 등... "
2025-12-03 17:03:00,"한국부동산마케팅협회, 취약계층에 '사랑의 연탄' 5000장 나눔",특히 서울시 매력일자리 인턴 참여자(김도현·루시드프로모)도 함께해 세대를 아우르는 나눔의 의미를 더했다. 한국부동산마케팅협회는 매년 수해 복구 성금 전달 및 불우이웃 돕기 등 회원사들과 함께 다양한 사회공헌... 
2025-12-03 17:02:00,"SH 서울 세운4구역 재개발 진퇴양난, 황상하 '오세훈 부동산 개발' 놓고...",황상하 서울주택도시공사 사장으로서는 오세훈 서울시장이 추진하는 여러 개발사업을 뒷받침해야 하는... 오 시장이 재개발·재건축 중심의 부동산 정책을 강하게 추진하고 있고 SH가 그 핵심 실행 기관 역할을 맡아온... 
2025-12-03 16:54:00,‘친환경 건설’ 어디까지 왔나… 현대·대우건설 앞장,"서울시·강동구 가이드라인에 따라 연료전지 195kW, 태양광 1,536kW, 지열(주거 593kW·비주거 574kW 등) 설비를... 권일 부동산인포 리서치팀장은 &quot;친환경주택 건설은 국내 뿐 아니라 세계적인 추세로 볼 수 있다&quot;며 &quot;조경... "
2025-12-03 16:41:00,송경택 서울시의원 “대장동 항소 포기… 국가가 정의를 버린 사건” 강...,"이날 기자회견은 ‘청년 서울시의원 이재명 정권 규탄’이라는 기차 하에 부동산 정책 실패와 전세대란, 고금리·고환율·고물가 ‘3고’ 경제 위기, 대장동 비리와 항소 포기 비판 등 세 가지 주제를 중심으로 진행됐으며... "
2025-12-03 16:40:00,미래에셋자산운용 신한은행 KB국민카드 外(금융 레이더),"2일 서울시 중구 동대문디자인플라자(DDP)에서 '2025 하나 ESG 더블임팩트 매칭펀드'의 성과를 공유하고... 이벤트는 'TIGER 코리아배당다우존스 ETF(0052D0)', 'TIGER 은행고배당플러스TOP10 ETF(466940)', 'TIGER 리츠부동산인프라... "
2025-12-03 16:34:00,"KB국민은행, '자립준비청년 지원 프로그램' 성과공유회 개최…신한은행...","단, 부동산 임대·공급업 등 일부 업종은 제외되며, 일정 신용등급 이상이고 최근 6개월 내 원리금 연체... 3일 서울시 송파구 한국인터넷진흥원 서울청사에서 열린 '스미싱 피해 예방 및 대응강화를 위한 업무 협약식'에... "
2025-12-03 16:34:00,서울시–내집스캔 '부동산 안전도 리포트' 폭발적 수요로 조기 종료··...,| 스마트에프엔 = 정민석 기자 | 서울시와 내집스캔이 협업해 지난 10월24일부터 선보인 안전도 분석 리포트... 예산이 예상보다 훨씬 빨리 소진되면서 '서울시가 최초로 도입한 리스크 사전검증 서비스'라는 평가와 함께 높은... 
2025-12-03 16:29:00,&quot;주택공급 민간이 주도해야...주거사다리 비아파트 위축 안돼&quot;,정부가 9·7 부동산 대책 등을 통해 공공 주도의 주택 공급을 공언하고 있는 상황에서 주택 공급 확대를... 실제로 김 실장이 국토교통부 주택공급실적 통계를 분석한 결과 지난해 서울시 기준 인허가는 전체 4만 6000호로... 
2025-12-03 16:22:00,김윤덕·오세훈 18일 만에 비공개 회동…'주택공급' 논의,"KB부동산에 따르면 11월 서울 아파트 매매가격은 전월 대비 1.72% 상승해, 2020년 9월 이후 5년 2개월 만에 최대 폭으로 올랐다. 오 시장은 김 장관에게 서울 신규 주택 공급 활성화를 위한 규제 개선을 요구한 것으로 알려졌다.... "
2025-12-03 16:16:00,"김윤덕·오세훈, 만찬 회동…부동산 정책 논의",민주신문=전주원 기자｜김윤덕 국토교통부 장관과 오세훈 서울시장이 서울 부동산 시장 안정과 도심 주택 공급 확대 방안을 논의하기 위해 다시 만났다. 3일 국토부에 따르면 김 장관과 오시장은 지난 1일 서울 모처에서... 
2025-12-03 16:12:00,"대원, 중림동 398번지 재개발 현설 참여 예고…정비사업 ‘승부수’","그동안 업계를 짓눌러온 미분양 리스크와 침체된 상업용 부동산 시장에서 한발 물러나, 사업성이 높은 서울시 내 재개발·재건축 등 정비사업 비중을 늘려 성장 동력을 다시 확보하겠다는 전략이다. 이번에 대원이 참여... "
2025-12-03 16:03:00,그린벨트 해제는 통할까… 주택공급 ‘기대반 의심반’,정부에선 서울시 극심한 반대에 부딪혔다. 윤석열 정부에선 서초 서리풀지구 등을 그린벨트에서 해제했지만... 서진형 광운대 부동산법무학과 교수는 &quot;그린벨트 해제는 해제 후 실제 공급까지 7~8년이 걸리는 중장기 대책... 
2025-12-03 16:00:00,"김윤덕 장관·오세훈 시장, 18일 만 주택 정책 논의 … 오시장, '노·도·...","당시 서울시는 10·15 부동산 대책 발표 이후 현장에서 즉각적으로 나타난 수요 위축, 정비사업 지연, 과도한 규제에 대한 문제를 상세히 전달했으며, 이번 회동에서도 이러한 현실적 어려움을 다시 강조한 것으로... "
2025-12-03 15:44:00,김윤덕 장관·오세훈 시장 비공개 회동…국토부 &quot;토허제 해제 논의 안 해...,당시 김 장관과 오 시장은 10·15 부동산 대책으로 인한 주택 시장의 부작용 및 추가적인 규제 개선 여지를 두고 향후 논의 필요성에 공감한 바 있다. 이후 국토부와 서울시 실무진은 수시 소통 채널을 구축해 실무협의회... 
2025-12-03 15:28:00,다시 만난 김윤덕·오세훈…국토부 &quot;토허제 해제 논의 안 해&quot;,"김윤덕 국토교통부 장관과 오세훈 서울시장이 다시 만나 서울 부동산 시장 안정과 도심 주택 공급 확대 방안을 논의했다. 3일 국토부 등에 따르면, 김 장관과 오 시장은 지난 1일 서울 모처에서 만찬 회동을 가졌다. 이는... "
2025-12-03 15:20:00,&quot;천안 2억 거래도 소명해라&quot;…부동산 자금출처조사 깐깐해진다,서울시도 지난 8월 부동산 거래신고 위법행위를 1천573건을 적발했다며 국세청에 통보한 증여 의심 사례로 아파트를 8억원에 매수하면서 부친에게 2억원을 차용한 사례를 들었습니다. 그간 관할 지자체나 국세청 등이... 
2025-12-03 15:20:00,김윤덕 장관·오세훈 시장 비공개 회동…‘서울 집값 안정화’ 논의,"KB부동산에 따르면 11월 서울 아파트 매매가격은 전월 대비 1.72% 상승해, 2020년 9월 이후 5년 2개월 만에 최대 폭으로 올랐다. 특히 오 시장은 김 장관에게 서울 신규 주택 공급 활성화를 위한 규제 개선을 요구한 것으로... "
2025-12-03 15:16:00,"강남급 규제에 노도강 '부글'…토허제 해제, 언제·어디까지 풀릴까","토허제 해제 '키'를 쥐고 있는 김윤덕 국토교통부 장관과 오세훈 서울시장의 비공개 만찬이 확인되면서... 한국부동산원에 따르면 노원·도봉구 10월 아파트 매매가격지수는 각각 101.72, 100.76으로 지난해 말 대비 1.49%, 0.59... "
2025-12-03 14:50:00,목동·신정동 재개발 속도… 강서고 인근 4200가구 대단지 조성,서울시와 자치구인 양천구를 중심으로 정비구역 지정과 정비계획 확정을 위한 절차를 밟고 있거나... 김학렬 스마트튜브 부동산연구소장은 “명문 학군과 인접한 목동 지역이라 입지가 굉장히 좋은 사업장”이라며... 
2025-12-03 14:14:00,"후암동 특별계획구역4, ‘전체통합재개발’로 방향…동의율 34% 돌파 입...","서울시가 지난 10월 31일 특별계획구역 지구단위계획 변경(안)을 공람한 가운데, 해당 지역 주민들로 구성된... 나온다.부동산 업계에서는 “통합개발이 가능할 경우 용적률·스카이라인·배치 계획에서 유리해 높은... "
2025-12-03 14:10:00,신규 미리내집 30%만 정책대출…신혼부부 임대주택 '현금 부담',"주택도시기금의 전세금 기준을 벗어났기 때문인데, 서울시 아파트 전세 중위가격을 고려하면 이에 한참 못... 지난 11월 기준 KB부동산 월간 통계에 따르면 지역별 아파트 중위전세가격은 전국이 2억5667만원인데 비해... "
2025-12-03 14:00:00,&quot;외부인 벌금 20만원&quot;...다니던 길에 아파트 짓더니 출입금지시킨 고덕...,3일 부동산 업계에 따르면 고덕동 고덕아르테온 아파트는 최근 단지 내 보행로·공용시설에 대한 외부인... 개방 약속하고 인허가 받은 단지 문제는 출입에 제한을 둔 해당 보행로는 재건축 인허가 당시 서울시에 공공... 
2025-12-03 13:59:00,교통·교육·쇼핑 한 권역에…'올인원 라이프' 주거 선택 기준으로 부상,"KB부동산 월간 선도 아파트(11월 기준)에 따르면 인천에서는 송도국제도시 ‘더샵송도센트럴파크3’가 3.3... 서울시 선도 아파트 1위는 강남구 압구정동 ‘현대14차’(3.3㎡당 2억 381만 원)로, 도보권에 한강공원과... "
2025-12-03 13:12:00,"GRESB, 지속가능투자 행사 개최…ESR켄달스퀘어·코람코 GRESB 리더 어워...","오후 세션에는 부동산 운용과 관련된 지속가능성에 대해 신승애 코람코 ESG담당, 최용한 NH-아문디 ESG... 이어 서울시 정책연구를 담당하는 김경원 서울연구원 박사가 글로벌 ESG규제 동향과 건물 온실가스... "
2025-12-03 13:02:00,[특징주 분석] 대형 공공수주 확보… 한신공영 건설관련주 밸류 회복 국...,"최근 한 달간 한신공영의 주가는 건설 경기 둔화 우려와 부동산 PF 리스크가 잔존하는 가운데 박스권 등락을... 이어, 서울시가 발주한 2,290억 원 규모의 강남역 일대 대심도 빗물배수터널 건설공사까지 따내며 공공 및... "
2025-12-03 13:02:00,"김윤덕 장관·오세훈 시장, 서울 집값 안정 해법 논의...비공개 회동","이번 회동은 지난달 13일 공개 오찬 회동에 이은 것으로 서울시는 10·15 부동산 대책 이후 현장에서 나타난 문제와 규제 개선 필요성을 제기했고, 국토부는 주택 공급 확대와 정책 실행을 위한 협력 방안을 논의했다. 이후... "
2025-12-03 12:47:00,"&quot;오세훈의 지난 4년은 '또다른 윤석열', 즉시 사퇴해야&quot;","오세훈의 부동산 계엄과 개발 독재를 막아달라&quot;라고 호소했다. [감사의 정원] &quot;오 시장, 행정 운영 전반과 비리 의혹에 검증 받아야&quot; ▲ 오세훈 서울시장 사퇴 촉구 오세훈OUT!공동행동 주최로 3일 오전 서울 종로구... "
2025-12-03 12:46:00,"[금융 이모저모] 우리은행, 탄소중립 실천 공로로 기후에너지환경부장...","2일 서울시 중구 동대문디자인플라자(DDP)에서 '2025 하나 ESG 더블임팩트 매칭펀드'의 성과를 공유하고... 조각투자는 부동산, 미술품, 음악저작권 등 실물 자산을 디지털화해 소액 단위로 분할·거래하는 방식으로, 새로운... "
2025-12-03 12:18:00,[특징주 분석] 고속터미널 재개발 기대에... 대성산업 자산가치 수급 탄...,"시장에서는 부동산 보유에 따른 잠재 수혜 기대감이 주가 방향성을 결정짓는 주요 변수로 작용하고 있다는... 서울시와 관련 업계에서 터미널 지하화 및 복합개발 논의가 구체화되면서, 인근에 약 1,000평 규모의 부지를... "
2025-12-03 11:52:00,"김윤덕 장관·오세훈 시장, 18일 만에 회동…서울 집값 안정화 논의","서울시는 10·15 부동산 대책 이후 현장에서 나타난 문제와 규제 개선 필요성을 제기했고, 국토부는 주택 공급 확대와 정책 실행을 위한 협력 방안을 논의했다. 이후 국토부와 서울시 실무진은 수시 소통 채널을 구축해... "
2025-12-03 11:52:00,&quot;우리 단지 지나갈 거면 20만원&quot;…'통행 부담금' 내라는 강동구 아파트,3일 부동산 업계에 따르면 고덕아르테온은 공지를 통해 중앙 보행로를 제외한 단지 전 구역의 외부인 출입을... 하지만 해당 보행로는 재건축 인허가 당시 서울시에 공공 개방을 약속한 곳이다. 아르테온 단지 중앙에서... 
2025-12-03 11:34:00,‘고터 재개발’ 기대에 주가 1000% 폭등한 천일고속… 신세계는?,"서울시는 서울고속버스터미널 부지 복합개발과 관련해 신세계센트럴, 서울고속버스터미널과 사전 협상에... 신세계 주가는 부동산·자동차여객터미널업 부문에 속한 신세계센트럴과 3분기 실적 개선 효과가 맞물리며... "
2025-12-03 11:22:00,"김경진, 연이어 '겹경사' 터졌다...난임 극복 후 쌍둥이 임신+부동산 4채...","빌라는 서울시에 땅이 없기 때문에 결국 새 아파트로 변한다. 느낌적으로 안다. 그 동네의 느낌, 냄새, 뭔가 느껴진다&quot;라며 부동산 전문가 같은 면모를 보여주기도 했다. 한편 김경진과 전수민은 지난 2020년 결혼해 부부의... "
2025-12-03 11:10:00,강남3구 아파트값 10년간 165% 폭등…신고가 속출하며 상승세 지속,"3일 부동산R114 자료에 따르면 2004 ~ 2024년 강남 3구의 가구당 아파트 평균 가격 상승률은 △서초구 331.5... DL이앤씨는 12월, 서울시 서초구 서초동 서초신동아 1, 2차 아파트를 재건축해 짓는 '아크로 드 서초'를... "
2025-12-03 11:04:00,재개발 시공자 입찰제안서에 공사비 변동기준·마감재 규격 의무화,한국부동산원에 따르면 지난해 공사비 검증 건수는 총 36건으로 2019년(3건)보다 12배 증가했다. 공사비 증액에... 국토부·서울시 기준 검토 결과 위반 소지는 없다고 결론 내렸다. 이에 GS건설과 현대산업개발 등의 입찰 참여... 
2025-12-03 10:54:00,&quot;언제 돈 모아 집 사나&quot; 월 100만씩 '줄줄'…서울 빌라·원룸 월세 폭등,서울의 비(非)아파트 임대시장의 월세가 연일 상승세를 기록하는 가운데 서울시가 추진 중인 소규모 오피스텔 규제 완화가 임대시장 공급 확대로 이어질지 주목된다. 3일 한국부동산원에 따르면 10월 서울 연립... 
2025-12-03 10:52:00,서울시 청년의원 '이재명 정권' 규탄 기자회견,"▲서울시 청년의원들이 3일 국회 소통관에서 기자회견을 열고 이재명 정권의 부동산 정책 실패, 경제 위기 관리 부실, 대장동 사태 책임 회피 등을 강력히 규탄하고&quot;민생을 외면한 무능한 정권&quot;이라며 정책 기조 전환과... "
2025-12-03 10:52:00,"[플맨픽-금융] KB국민은행, '자립준비청년 사회정착 지원 프로그램' 성과...","조각투자는 부동산, 미술품, 음악저작권 등 실물 자산을 디지털화해 소액 단위로 분할·거래하는 방식으로... 하나금융, '2025 하나 ESG 더블임팩트 매칭펀드' 데모데이 성료 하나금융그룹(회장 함영주)은 지난 2일 서울시... "
